{
  "id": "ds_farmforest_crops_v1",
  "name": "FarmForest expert cropland polygons",
  "description": "Expert-delineated cropland parcels (FarmForest class 5), used as crop positives.",
  "kind": "polygons",
  "classes": [ { "class": "crops", "name": "Crops", "count": 110, "description": "irrigated + rain-fed agricultural parcels" } ],
  "definition": { "type": "polygons", "path": "data/examples/crops.geojson" },
  "extent": {
    "spatial": { "type": "region", "value": "India" },
    "temporal": { "year": 2024 }
  },
  "embedding": { "source": "alphaearth", "dim": 64, "year": 2024 },
  "provenance": {
    "annotator": "FarmForest expert team",
    "method": "expert delineation of cropland parcels",
    "evidence": ["field knowledge", "high-res basemap interpretation"],
    "license": null,
    "notes": "FarmForest class 5 (crop)."
  },
  "quality": { "n_polygons": 110, "occupied_cells": 77, "spatial_diversity": 0.889, "class_balance": { "crops": 1.0 } },
  "version": 1,
  "created": "2026-06-13T00:00:00Z"
}
